{
  "source_type": "code4rena-report",
  "source_name": "Code4rena Kinetiq Findings and Analysis Report (2025-04)",
  "source_url": "https://code4rena.com/reports/2025-04-kinetiq#m-02",
  "protocol_name": "Kinetiq",
  "project_repo": "https://github.com/code-423n4/2025-04-kinetiq",
  "language": "solidity",
  "severity": "medium",
  "validation_status": "acknowledged-by-sponsor",
  "validation_style": [
    "public-contest-finding",
    "report-included-code-links"
  ],
  "id": "c4-2025-04-kinetiq-m-02",
  "component_types": [
    "staking-manager",
    "withdrawal-flow"
  ],
  "finding_title": "Missing withdrawal pause check in confirmWithdrawal allows bypassing withdrawal restrictions",
  "summary": "The StakingManager::confirmWithdrawal() function does not include the whenWithdrawalNotPaused modifier, despite being a withdrawal operation. According to the natspec docs of pauseWithdrawal(), it should pause all withdrawal operations:",
  "root_cause": "Report-described logic/accounting flaw: The StakingManager::confirmWithdrawal() function does not include the whenWithdrawalNotPaused modifier, despite being a withdrawal operation. According to the natspec docs of pauseWithdrawal(), it should pause all withdrawal operations:",
  "broken_invariants": [
    "The staking-manager accounting/control flow should preserve user funds and protocol solvency.",
    "The withdrawal-flow accounting/control flow should preserve user funds and protocol solvency."
  ],
  "attack_preconditions": [
    "Protocol state reaches the report-described edge case or queue configuration",
    "Relevant manager/operator/user flow is executed as described in the public finding"
  ],
  "attacker_capability": "external user or operational actor able to trigger the affected protocol path",
  "trigger_actions": [
    "execute the affected function sequence described in the report",
    "observe accounting/state transition divergence or operation failure"
  ],
  "impact": {
    "type": "protocol-disruption-or-loss-of-expected-functionality",
    "description": "The StakingManager::confirmWithdrawal() function does not include the whenWithdrawalNotPaused modifier, despite being a withdrawal operation. According to the natspec docs of pauseWithdrawal(), it should pause all withdrawal operations:"
  },
  "why_not_higher": "the report classified this as Medium rather than High; impact is bounded to disruption, bypass, or indirect value loss rather than unconditional total protocol loss",
  "why_not_lower": "included as a validated High/Medium C4 finding with concrete affected code paths and exploit/impact narrative",
  "common_false_positive_angles": [
    "check whether the affected function is actually reachable under current roles/pauses/configuration",
    "check whether sponsor mitigations or operational assumptions fully eliminate the stated state transition",
    "check whether the code version and line links match the audited commit"
  ],
  "mitigations": [
    "Add withdrawal pause modifier - function confirmWithdrawal(uint256 withdrawalId) external nonReentrant whenNotPaused { + function confirmWithdrawal(uint256 withdrawalId) external nonReentrant whenNotPaused whenWithdrawalNotPaused { uint256 amount = _processConfirmation(msg.sender, withdrawalId); // ... }"
  ],
  "snippets": [
    {
      "role": "affected-code",
      "code": "https://github.com/code-423n4/2025-04-kinetiq/blob/7f29c917c09341672e73be2f7917edf920ea2adb/src/StakingManager.sol#L302-L312",
      "note": "GitHub permalink from final report"
    }
  ],
  "tags": [
    "kinetiq",
    "staking",
    "withdrawal",
    "pause-control",
    "access-control",
    "medium"
  ]
}
