{
  "source_type": "code4rena-report",
  "source_name": "Code4rena Angle Findings and Analysis Report (2023-06)",
  "source_url": "https://code4rena.com/reports/2023-06-angle",
  "protocol_name": "Angle",
  "project_repo": "https://github.com/code-423n4/2023-06-angle",
  "language": "solidity",
  "severity": "high",
  "validation_status": "confirmed-by-sponsor",
  "validation_style": [
    "public-contest-finding",
    "report-included-code-links"
  ],
  "id": "c4-2023-06-angle-h-01",
  "component_types": [
    "collateral-management",
    "redemption-flow"
  ],
  "finding_title": "Possible reentrancy during redemption/swap",
  "summary": "Redeemers might charge more collaterals during redemption/swap by the reentrancy attack.",
  "root_cause": "reentrancy-sensitive external interaction in Possible reentrancy during redemption/swap, allowing transient or nested state to affect protocol accounting",
  "broken_invariants": [
    "the collateral management path must not allow the condition described by \"Possible reentrancy during redemption/swap\" to change user balances, collateralization, or protocol availability unexpectedly",
    "oracle, TVL, and collateral valuation must use correctly scaled, fresh, and manipulation-resistant inputs",
    "users must retain a reliable exit path unless an explicitly designed and validated pause or restriction is active"
  ],
  "attack_preconditions": [
    "the affected component is deployed or configured in the way described by the final report",
    "the report-described user, keeper, vault, connector, oracle, or liquidation flow is reachable in the audited code version"
  ],
  "attacker_capability": "external user, keeper, liquidator, vault participant, or protocol-integrated actor able to trigger the affected flow",
  "trigger_actions": [
    "execute the report-described function sequence or state transition",
    "observe mispricing, accounting drift, value loss, fund lock, or denial of service"
  ],
  "impact": {
    "type": "loss-of-funds-or-protocol-disruption",
    "description": "Redeemers might charge more collaterals during redemption/swap by the reentrancy attack."
  },
  "why_not_higher": "already classified as High in the final C4 report",
  "why_not_lower": "included as a validated High/Medium C4 finding with public report evidence and affected code/finding references",
  "common_false_positive_angles": [
    "verify the same component and configuration are in scope",
    "check whether the issue is reachable by an untrusted or economically motivated actor",
    "confirm the impact is more than a view-only mismatch, dust loss, or privileged-only misconfiguration"
  ],
  "mitigations": [
    "I think we should add the nonReentrant modifier to the major functions like redeem()/swap()."
  ],
  "snippets": [
    {
      "role": "affected-code",
      "code": "https://github.com/AngleProtocol/angle-transmuter/blob/9707ee4ed3d221e02dcfcd2ebaa4b4d38d280936/contracts/transmuter/facets/Redeemer.sol#L131",
      "note": "GitHub link from final Code4rena report"
    },
    {
      "role": "affected-code",
      "code": "https://github.com/AngleProtocol/angle-transmuter/blob/9707ee4ed3d221e02dcfcd2ebaa4b4d38d280936/contracts/transmuter/facets/Redeemer.sol#L167",
      "note": "GitHub link from final Code4rena report"
    },
    {
      "role": "finding-reference",
      "code": "https://github.com/code-423n4/2023-06-angle-findings/issues/24",
      "note": "GitHub link from final Code4rena report"
    },
    {
      "role": "finding-reference",
      "code": "https://github.com/code-423n4/2023-06-angle-findings/issues/24#issuecomment-1628650145",
      "note": "GitHub link from final Code4rena report"
    },
    {
      "role": "finding-reference",
      "code": "https://github.com/code-423n4/2023-06-angle-findings/issues/24#issuecomment-1628722575",
      "note": "GitHub link from final Code4rena report"
    },
    {
      "role": "finding-reference",
      "code": "https://github.com/code-423n4/2023-06-angle-findings/issues/6",
      "note": "GitHub link from final Code4rena report"
    },
    {
      "role": "finding-reference",
      "code": "https://github.com/code-423n4/2023-07-angle-mitigation-findings/issues/13",
      "note": "GitHub link from final Code4rena report"
    },
    {
      "role": "finding-reference",
      "code": "https://github.com/code-423n4/2023-07-angle-mitigation-findings/issues/22",
      "note": "GitHub link from final Code4rena report"
    },
    {
      "role": "finding-reference",
      "code": "https://github.com/code-423n4/2023-07-angle-mitigation-findings/issues/6",
      "note": "GitHub link from final Code4rena report"
    },
    {
      "role": "finding-reference",
      "code": "https://github.com/AngleProtocol/angle-transmuter/commit/864c1c47cb550f8e337244f0f70409a171a4e671",
      "note": "GitHub link from final Code4rena report"
    },
    {
      "role": "finding-reference",
      "code": "https://github.com/code-423n4/2023-07-angle-mitigation/blob/main/README.md#mitigations-to-be-reviewed",
      "note": "GitHub link from final Code4rena report"
    }
  ],
  "tags": [
    "collateral",
    "redemption",
    "reentrancy",
    "curve"
  ]
}
