{
  "source_type": "code4rena-report",
  "source_name": "Code4rena Noya Findings and Analysis Report (2024-04)",
  "source_url": "https://code4rena.com/reports/2024-04-noya",
  "protocol_name": "Noya",
  "project_repo": "https://github.com/code-423n4/2024-04-noya",
  "language": "solidity",
  "severity": "high",
  "validation_status": "confirmed-by-sponsor",
  "validation_style": [
    "public-contest-finding",
    "report-included-code-links"
  ],
  "id": "c4-2024-04-noya-h-23",
  "component_types": [
    "collateral-management",
    "connector",
    "position-accounting",
    "token"
  ],
  "finding_title": "Invalid handling of holding positions in DolomiteConnector::transferBetweenAccounts",
  "summary": "In Dolomite protocol, transferBetweenAccounts transfers the collateral from 1 account to another under the same owner. So the owner of both accounts still owns these funds regardless of the account they’re deposited in. In DolomiteConnector, when calling transferBetweenAccounts the protocol isn’t updating the holding position of either account.",
  "root_cause": "incorrect accounting or validation logic in Invalid handling of holding positions in DolomiteConnector::transferBetweenAccounts, causing the protocol to compute or enforce the wrong state transition",
  "broken_invariants": [
    "the collateral management path must not allow the condition described by \"Invalid handling of holding positions in DolomiteConnector::transferBetweenAccounts\" to change user balances, collateralization, or protocol availability unexpectedly",
    "oracle, TVL, and collateral valuation must use correctly scaled, fresh, and manipulation-resistant inputs",
    "privileged, owner, and license checks must be enforced on every value-moving path, not only on the nominal entry point"
  ],
  "attack_preconditions": [
    "the affected component is deployed or configured in the way described by the final report",
    "the report-described user, keeper, vault, connector, oracle, or liquidation flow is reachable in the audited code version"
  ],
  "attacker_capability": "external user, keeper, liquidator, vault participant, or protocol-integrated actor able to trigger the affected flow",
  "trigger_actions": [
    "execute the report-described function sequence or state transition",
    "observe mispricing, accounting drift, value loss, fund lock, or denial of service"
  ],
  "impact": {
    "type": "loss-of-funds-or-protocol-disruption",
    "description": "In Dolomite protocol, transferBetweenAccounts transfers the collateral from 1 account to another under the same owner. So the owner of both accounts still owns these funds regardless of the account they’re deposited in. In DolomiteConnector, when calling transferBetweenAccounts the protocol isn’t updating the holding position of either account."
  },
  "why_not_higher": "already classified as High in the final C4 report",
  "why_not_lower": "included as a validated High/Medium C4 finding with public report evidence and affected code/finding references",
  "common_false_positive_angles": [
    "verify the same component and configuration are in scope",
    "check whether the issue is reachable by an untrusted or economically motivated actor",
    "confirm the impact is more than a view-only mismatch, dust loss, or privileged-only misconfiguration"
  ],
  "mitigations": [
    "Add the following at the bottom of DolomiteConnector::transferBetweenAccounts: (uint256[] memory markets0,,,) = dolomiteMargin.getAccountBalances(Info(address(this), 0)); registry.updateHoldingPosition( vaultId, registry.calculatePositionId(address(this), DOL_POSITION_ID, \"\"), abi.encode(0), \"\", markets0.length == 0 ); (uint256[] memory markets1,,,) = dolomiteMargin.getAccountBalances(Info(address(this), accountId)); registry.updateHoldingPosition( vaultId, registry.calculatePositionId(address(this), DOL_POSITION_ID, \"\"), abi.encode(accountId), \"\", markets1.length == 0 ); This updates the holding positions of both accounts, by either setting or removing the position according to the open markets of each."
  ],
  "snippets": [
    {
      "role": "finding-reference",
      "code": "https://github.com/code-423n4/2024-04-noya-findings/issues/1018",
      "note": "GitHub link from final Code4rena report"
    },
    {
      "role": "finding-reference",
      "code": "https://github.com/code-423n4/2024-04-noya-findings/issues/1018#event-12909642817",
      "note": "GitHub link from final Code4rena report"
    },
    {
      "role": "finding-reference",
      "code": "https://github.com/code-423n4/2024-04-noya-findings/issues/1020",
      "note": "GitHub link from final Code4rena report"
    },
    {
      "role": "finding-reference",
      "code": "https://github.com/code-423n4/2024-04-noya-findings/issues/1094",
      "note": "GitHub link from final Code4rena report"
    },
    {
      "role": "finding-reference",
      "code": "https://github.com/code-423n4/2024-04-noya-findings/issues/1094#event-12907067812",
      "note": "GitHub link from final Code4rena report"
    },
    {
      "role": "finding-reference",
      "code": "https://github.com/code-423n4/2024-04-noya-findings/issues/1097",
      "note": "GitHub link from final Code4rena report"
    },
    {
      "role": "finding-reference",
      "code": "https://github.com/code-423n4/2024-04-noya-findings/issues/1097#event-12907050614",
      "note": "GitHub link from final Code4rena report"
    },
    {
      "role": "finding-reference",
      "code": "https://github.com/code-423n4/2024-04-noya-findings/issues/1103",
      "note": "GitHub link from final Code4rena report"
    },
    {
      "role": "finding-reference",
      "code": "https://github.com/code-423n4/2024-04-noya-findings/issues/1110",
      "note": "GitHub link from final Code4rena report"
    },
    {
      "role": "finding-reference",
      "code": "https://github.com/code-423n4/2024-04-noya-findings/issues/1110#event-12906884317",
      "note": "GitHub link from final Code4rena report"
    },
    {
      "role": "finding-reference",
      "code": "https://github.com/code-423n4/2024-04-noya-findings/issues/1112",
      "note": "GitHub link from final Code4rena report"
    },
    {
      "role": "finding-reference",
      "code": "https://github.com/code-423n4/2024-04-noya-findings/issues/1112#event-12906913215",
      "note": "GitHub link from final Code4rena report"
    },
    {
      "role": "finding-reference",
      "code": "https://github.com/code-423n4/2024-04-noya-findings/issues/1128",
      "note": "GitHub link from final Code4rena report"
    },
    {
      "role": "finding-reference",
      "code": "https://github.com/code-423n4/2024-04-noya-findings/issues/1128#event-13231311211",
      "note": "GitHub link from final Code4rena report"
    },
    {
      "role": "finding-reference",
      "code": "https://github.com/code-423n4/2024-04-noya-findings/issues/1177",
      "note": "GitHub link from final Code4rena report"
    },
    {
      "role": "finding-reference",
      "code": "https://github.com/code-423n4/2024-04-noya-findings/issues/1177#event-12948172725",
      "note": "GitHub link from final Code4rena report"
    },
    {
      "role": "finding-reference",
      "code": "https://github.com/code-423n4/2024-04-noya-findings/issues/1183",
      "note": "GitHub link from final Code4rena report"
    },
    {
      "role": "finding-reference",
      "code": "https://github.com/code-423n4/2024-04-noya-findings/issues/120",
      "note": "GitHub link from final Code4rena report"
    },
    {
      "role": "finding-reference",
      "code": "https://github.com/code-423n4/2024-04-noya-findings/issues/1228",
      "note": "GitHub link from final Code4rena report"
    },
    {
      "role": "finding-reference",
      "code": "https://github.com/code-423n4/2024-04-noya-findings/issues/1228#event-13160174314",
      "note": "GitHub link from final Code4rena report"
    },
    {
      "role": "finding-reference",
      "code": "https://github.com/code-423n4/2024-04-noya-findings/issues/1235",
      "note": "GitHub link from final Code4rena report"
    },
    {
      "role": "finding-reference",
      "code": "https://github.com/code-423n4/2024-04-noya-findings/issues/1236",
      "note": "GitHub link from final Code4rena report"
    },
    {
      "role": "finding-reference",
      "code": "https://github.com/code-423n4/2024-04-noya-findings/issues/1236#event-13160120059",
      "note": "GitHub link from final Code4rena report"
    },
    {
      "role": "finding-reference",
      "code": "https://github.com/code-423n4/2024-04-noya-findings/issues/1263",
      "note": "GitHub link from final Code4rena report"
    },
    {
      "role": "finding-reference",
      "code": "https://github.com/code-423n4/2024-04-noya-findings/issues/1263#event-13146813780",
      "note": "GitHub link from final Code4rena report"
    }
  ],
  "tags": [
    "tvl-accounting",
    "collateral",
    "owner-check",
    "connector",
    "position-accounting",
    "dolomite",
    "erc20"
  ]
}
