{
  "source_type": "code4rena-report",
  "source_name": "Code4rena Noya Findings and Analysis Report (2024-04)",
  "source_url": "https://code4rena.com/reports/2024-04-noya",
  "protocol_name": "Noya",
  "project_repo": "https://github.com/code-423n4/2024-04-noya",
  "language": "solidity",
  "severity": "high",
  "validation_status": "confirmed-by-sponsor",
  "validation_style": [
    "public-contest-finding",
    "report-included-code-links"
  ],
  "id": "c4-2024-04-noya-h-02",
  "component_types": [
    "vault",
    "position-accounting"
  ],
  "finding_title": "Base tokens like USDT, USDC having different decimals on different chains can have their TVL updated incorrectly",
  "summary": "Tokens like USDT, USDC on the BSC chain have 18 decimals while the “Base” blockchain which is being used as the root/base chain uses 6 decimals (see here).",
  "root_cause": "incorrect accounting or validation logic in Base tokens like USDT, USDC having different decimals on different chains can have their TVL updated incorrectly, causing the protocol to compute or enforce the wrong state transition",
  "broken_invariants": [
    "the vault path must not allow the condition described by \"Base tokens like USDT, USDC having different decimals on different chains can have their TVL updated incorrectly\" to change user balances, collateralization, or protocol availability unexpectedly",
    "oracle, TVL, and collateral valuation must use correctly scaled, fresh, and manipulation-resistant inputs",
    "state changes must remain internally consistent across all affected accounting buckets and external integrations"
  ],
  "attack_preconditions": [
    "the affected component is deployed or configured in the way described by the final report",
    "the report-described user, keeper, vault, connector, oracle, or liquidation flow is reachable in the audited code version"
  ],
  "attacker_capability": "external user, keeper, liquidator, vault participant, or protocol-integrated actor able to trigger the affected flow",
  "trigger_actions": [
    "execute the report-described function sequence or state transition",
    "observe mispricing, accounting drift, value loss, fund lock, or denial of service"
  ],
  "impact": {
    "type": "loss-of-funds-or-protocol-disruption",
    "description": "Tokens like USDT, USDC on the BSC chain have 18 decimals while the “Base” blockchain which is being used as the root/base chain uses 6 decimals (see here)."
  },
  "why_not_higher": "already classified as High in the final C4 report",
  "why_not_lower": "included as a validated High/Medium C4 finding with public report evidence and affected code/finding references",
  "common_false_positive_angles": [
    "verify the same component and configuration are in scope",
    "check whether the issue is reachable by an untrusted or economically motivated actor",
    "confirm the impact is more than a view-only mismatch, dust loss, or privileged-only misconfiguration"
  ],
  "mitigations": [
    "Keep track of the decimals of tokens on other chains in a mapping. If they are more or less, consider scaling them once the tvl update is received on the base chain."
  ],
  "snippets": [
    {
      "role": "affected-code",
      "code": "https://github.com/code-423n4/2024-04-noya/blob/9c79b332eff82011dcfa1e8fd51bad805159d758/contracts/accountingManager/AccountingManager.sol#L591",
      "note": "GitHub link from final Code4rena report"
    },
    {
      "role": "affected-code",
      "code": "https://github.com/code-423n4/2024-04-noya/blob/9c79b332eff82011dcfa1e8fd51bad805159d758/contracts/accountingManager/AccountingManager.sol#L592",
      "note": "GitHub link from final Code4rena report"
    },
    {
      "role": "affected-code",
      "code": "https://github.com/code-423n4/2024-04-noya/blob/9c79b332eff82011dcfa1e8fd51bad805159d758/contracts/accountingManager/AccountingManager.sol#L627",
      "note": "GitHub link from final Code4rena report"
    },
    {
      "role": "affected-code",
      "code": "https://github.com/code-423n4/2024-04-noya/blob/9c79b332eff82011dcfa1e8fd51bad805159d758/contracts/accountingManager/AccountingManager.sol#L627C1-L630C6",
      "note": "GitHub link from final Code4rena report"
    },
    {
      "role": "affected-code",
      "code": "https://github.com/code-423n4/2024-04-noya/blob/9c79b332eff82011dcfa1e8fd51bad805159d758/contracts/helpers/LZHelpers/LZHelperReceiver.sol#L65",
      "note": "GitHub link from final Code4rena report"
    },
    {
      "role": "affected-code",
      "code": "https://github.com/code-423n4/2024-04-noya/blob/9c79b332eff82011dcfa1e8fd51bad805159d758/contracts/helpers/OmniChainHandler/OmnichainManagerBaseChain.sol#L32",
      "note": "GitHub link from final Code4rena report"
    },
    {
      "role": "affected-code",
      "code": "https://github.com/code-423n4/2024-04-noya/blob/9c79b332eff82011dcfa1e8fd51bad805159d758/contracts/helpers/OmniChainHandler/OmnichainManagerNormalChain.sol#L28",
      "note": "GitHub link from final Code4rena report"
    },
    {
      "role": "finding-reference",
      "code": "https://github.com/code-423n4/2024-04-noya-findings/issues/1294",
      "note": "GitHub link from final Code4rena report"
    },
    {
      "role": "finding-reference",
      "code": "https://github.com/code-423n4/2024-04-noya-findings/issues/1358",
      "note": "GitHub link from final Code4rena report"
    },
    {
      "role": "finding-reference",
      "code": "https://github.com/code-423n4/2024-04-noya-findings/issues/1438",
      "note": "GitHub link from final Code4rena report"
    },
    {
      "role": "finding-reference",
      "code": "https://github.com/code-423n4/2024-04-noya-findings/issues/1438#event-12904795203",
      "note": "GitHub link from final Code4rena report"
    }
  ],
  "tags": [
    "tvl-accounting",
    "vault",
    "decimal-scaling",
    "position-accounting"
  ]
}
